{
  "meta": {
    "title": "MacBook Neo",
    "description": "Продуктовая страница MacBook Neo — самый доступный ноутбук Apple с A18 Pro, 13\" Liquid Retina дисплеем и Apple Intelligence",
    "purpose": "product_landing",
    "target_audience": "Студенты и повседневные пользователи, ищущие доступный и стильный Mac",
    "brand_voice": "premium",
    "locale": "en-US"
  },

  "design_tokens": {
    "color_scheme": {
      "mode": "mixed",
      "primary": "#0071e3",
      "secondary": "#1d1d1f",
      "background": "#000000",
      "surface": "#161617",
      "text_primary": "#f5f5f7",
      "text_secondary": "#86868b",
      "accent": "#2997ff"
    },
    "typography": {
      "font_family_heading": "SF Pro Display",
      "font_family_body": "SF Pro Text",
      "scale": "editorial"
    },
    "spacing": "ultra_spacious",
    "border_radius": "large",
    "max_width": "980px"
  },

  "navigation": {
    "type": "fixed_top",
    "style": "blur",
    "items": [
      { "label": "Overview", "anchor": "#hero", "type": "link" },
      { "label": "Design", "anchor": "#design", "type": "link" },
      { "label": "Apple Intelligence", "anchor": "#apple-intelligence", "type": "link" },
      { "label": "macOS", "anchor": "#macos", "type": "link" },
      { "label": "Specs", "anchor": "#specs", "type": "link" }
    ],
    "cta": {
      "label": "Buy",
      "style": "primary"
    }
  },

  "sections": [
    {
      "id": "hero",
      "type": "hero",
      "layout": {
        "structure": "centered",
        "content_alignment": "center",
        "height": "viewport",
        "padding": "large"
      },
      "appearance": {
        "background": { "type": "color", "value": "#000000" },
        "theme_override": "dark"
      },
      "content": {
        "eyebrow": "Introducing",
        "heading": {
          "text": "MacBook Neo",
          "level": "h1",
          "size": "jumbo"
        },
        "subheading": "Welcome to the family.",
        "body": "An amazing Mac at a surprising price. With a durable design, beautiful colors, and powerful features, it's a magical new way to fall head over heels with Mac, every day.",
        "media": [
          {
            "type": "image",
            "role": "hero_image",
            "placement": "below_content",
            "sizing": "full_bleed",
            "alt_description": "MacBook Neo ноутбук в четырёх цветах — Silver, Blush, Citrus, Indigo — расположены веером на тёмном фоне",
            "aspect_ratio": "16:9"
          }
        ],
        "cta": [
          { "label": "Watch the film", "style": "text_link", "action": "play_video", "icon": "play" },
          { "label": "Watch the event", "style": "text_link", "action": "play_video", "icon": "play" }
        ]
      },
      "animation": {
        "entrance": "fade_in",
        "trigger": "on_load",
        "duration": "slow"
      }
    },

    {
      "id": "colors",
      "type": "color_picker",
      "layout": {
        "structure": "centered",
        "content_alignment": "center",
        "height": "viewport",
        "padding": "xlarge"
      },
      "appearance": {
        "background": { "type": "color", "value": "#000000" },
        "theme_override": "dark"
      },
      "content": {
        "eyebrow": "Colors",
        "heading": {
          "text": "The most colorful MacBook lineup ever.",
          "level": "h2",
          "size": "display"
        },
        "subheading": "Four stunning colors. One durable design.",
        "media": [
          {
            "type": "image",
            "role": "product_shot",
            "placement": "below_content",
            "sizing": "contain",
            "alt_description": "MacBook Neo крупным планом в выбранном цвете, вид сверху под углом",
            "aspect_ratio": "16:9"
          }
        ],
        "interactive": {
          "type": "color_selector",
          "options": [
            { "label": "Silver", "value": "#e3e4e5" },
            { "label": "Blush", "value": "#f4c2c2" },
            { "label": "Citrus", "value": "#f5d76e" },
            { "label": "Indigo", "value": "#4b5dbd" }
          ]
        }
      },
      "animation": {
        "entrance": "fade_up",
        "trigger": "on_scroll",
        "scroll_behavior": "pin_and_reveal"
      }
    },

    {
      "id": "design",
      "type": "feature_showcase",
      "layout": {
        "structure": "centered",
        "content_alignment": "center",
        "height": "auto",
        "padding": "xlarge"
      },
      "appearance": {
        "background": { "type": "color", "value": "#161617" },
        "theme_override": "dark",
        "separator": "gradient_fade"
      },
      "content": {
        "eyebrow": "Design",
        "heading": {
          "text": "Durable design. Made to last.",
          "level": "h2",
          "size": "display"
        },
        "body": "MacBook Neo is made with a durable recycled aluminum enclosure that helps it reach 60 percent recycled content by weight, the most ever in any Apple product.",
        "media": [
          {
            "type": "image",
            "role": "product_shot",
            "placement": "below_content",
            "sizing": "full_bleed",
            "alt_description": "Крупный план корпуса MacBook Neo из переработанного алюминия, видны текстура и грани",
            "aspect_ratio": "21:9"
          }
        ],
        "badges": [
          { "text": "60% recycled content", "variant": "success" }
        ]
      },
      "animation": {
        "entrance": "fade_up",
        "trigger": "on_scroll",
        "duration": "normal"
      }
    },

    {
      "id": "display",
      "type": "feature_showcase",
      "layout": {
        "structure": "centered",
        "content_alignment": "center",
        "height": "auto",
        "padding": "xlarge"
      },
      "appearance": {
        "background": { "type": "color", "value": "#000000" },
        "theme_override": "dark"
      },
      "content": {
        "eyebrow": "Display",
        "heading": {
          "text": "See it all in stunning clarity.",
          "level": "h2",
          "size": "display"
        },
        "body": "With outstanding resolution and 500 nits of brightness, the 13-inch Liquid Retina display brings photos, websites, and videos to life with refreshing clarity and vivid colors.",
        "media": [
          {
            "type": "image",
            "role": "product_shot",
            "placement": "below_content",
            "sizing": "contain",
            "alt_description": "Экран MacBook Neo отображает яркое цветное изображение, демонстрируя качество Liquid Retina дисплея",
            "aspect_ratio": "16:9"
          }
        ],
        "specs": [
          { "label": "Display", "value": "13\" Liquid Retina" },
          { "label": "Resolution", "value": "2408 × 1506" },
          { "label": "Brightness", "value": "500 nits" }
        ]
      },
      "animation": {
        "entrance": "fade_up",
        "trigger": "on_scroll",
        "scroll_behavior": "parallax"
      }
    },

    {
      "id": "keyboard",
      "type": "feature_showcase",
      "layout": {
        "structure": "split_50_50",
        "content_alignment": "left",
        "height": "auto",
        "padding": "xlarge"
      },
      "appearance": {
        "background": { "type": "color", "value": "#161617" },
        "theme_override": "dark"
      },
      "content": {
        "eyebrow": "Keyboard and Trackpad",
        "heading": {
          "text": "Typing made magical.",
          "level": "h2",
          "size": "large"
        },
        "body": "The Magic Keyboard delivers a precise and comfortable typing experience. And the large Multi-Touch trackpad lets you tap, pinch, swipe, and click anywhere.",
        "media": [
          {
            "type": "image",
            "role": "product_shot",
            "placement": "right",
            "sizing": "contain",
            "alt_description": "Крупный план клавиатуры и трекпада MacBook Neo, видны клавиши и большой Multi-Touch трекпад",
            "aspect_ratio": "4:3"
          }
        ]
      },
      "animation": {
        "entrance": "slide_right",
        "trigger": "on_scroll"
      }
    },

    {
      "id": "touch-id",
      "type": "feature_showcase",
      "layout": {
        "structure": "split_50_50",
        "content_alignment": "right",
        "height": "auto",
        "padding": "large"
      },
      "appearance": {
        "background": { "type": "color", "value": "#000000" },
        "theme_override": "dark"
      },
      "content": {
        "eyebrow": "Touch ID",
        "heading": {
          "text": "Your fingerprint is your password.",
          "level": "h2",
          "size": "large"
        },
        "body": "Touch ID lets you easily unlock your MacBook Neo, sign in to websites and apps, and download apps with the touch of your finger.",
        "media": [
          {
            "type": "image",
            "role": "product_shot",
            "placement": "left",
            "sizing": "contain",
            "alt_description": "Палец касается сенсора Touch ID в верхнем правом углу клавиатуры MacBook Neo",
            "aspect_ratio": "1:1"
          }
        ]
      },
      "animation": {
        "entrance": "slide_left",
        "trigger": "on_scroll"
      }
    },

    {
      "id": "camera-audio",
      "type": "feature_showcase",
      "layout": {
        "structure": "grid_2col",
        "content_alignment": "center",
        "height": "auto",
        "padding": "xlarge"
      },
      "appearance": {
        "background": { "type": "color", "value": "#161617" },
        "theme_override": "dark"
      },
      "content": {
        "heading": {
          "text": "Look sharp. Sound great.",
          "level": "h2",
          "size": "display"
        },
        "bullets": [
          {
            "icon": "camera",
            "title": "1080p FaceTime HD Camera",